{
  "$schema": "https://json-schema.org/draft/2020-12/schema",
  "$id": "https://openvaluesstandard.org/schema/node-index-v0.1.schema.json",
  "title": "Open Values Node Index v0.1",
  "description": "A list of the things a reader can look up on the site besides single entries: brands, the companies that own them, labels such as \"organic\", and errands. The data build writes one file per kind (brands.json, companies.json, tags.json, errands.json), and the site's search and node pages read them.",
  "type": "object",
  "additionalProperties": true,
  "required": [
    "format",
    "version",
    "built",
    "nodes"
  ],
  "properties": {
    "format": {
      "description": "Names this file's format. Always \"ovs-node-index\"; brands.json, companies.json, tags.json and errands.json all use it.",
      "const": "ovs-node-index"
    },
    "type": {
      "description": "Which kind of node this file holds: \"brand\", \"company\", \"tag\" or \"errand\". Missing in the hand-written sample.json.",
      "type": "string"
    },
    "version": {
      "description": "The version of the format this file follows, such as \"0.1\".",
      "type": "string",
      "pattern": "^0\\.1(?:\\.0)?(?:[-+].*)?$"
    },
    "built": {
      "description": "The date of the source data this file was built from, as YYYY-MM-DD.",
      "type": "string",
      "pattern": "^\\d{4}-\\d{2}-\\d{2}$"
    },
    "minItems": {
      "description": "The fewest entries a node needs to be listed. Brands need 2; tags take the number from content/tags.json.",
      "type": "integer",
      "minimum": 1
    },
    "source": {
      "description": "The file or files this index was built from, as paths in the repository.",
      "type": [
        "string",
        "array"
      ]
    },
    "nodes": {
      "description": "The nodes in this index.",
      "type": "array",
      "minItems": 1,
      "items": {
        "$ref": "#/$defs/node"
      }
    },
    "longTail": {
      "description": "Brands only: how many brand names were left out because they appear on fewer than 2 entries.",
      "type": "integer",
      "minimum": 0
    },
    "longTailItems": {
      "description": "Brands only: how many entries carry one of those left-out brand names.",
      "type": "integer",
      "minimum": 0
    },
    "descriptorItems": {
      "description": "Brands only: how many entries have a brand field that is not a usable brand name, such as \"n/a\" or a value listed in content/non-brand-values.json. These entries are not grouped under any brand.",
      "type": "integer",
      "minimum": 0
    }
  },
  "$defs": {
    "nodeId": {
      "type": "string",
      "pattern": "^ovs:[a-z0-9-]+/[A-Za-z0-9._:-]+(?:-[A-Za-z0-9._:-]+)*$"
    },
    "node": {
      "type": "object",
      "additionalProperties": true,
      "required": [
        "id",
        "label"
      ],
      "properties": {
        "id": {
          "description": "The node's id, in the form ovs:<type>/<slug>, such as \"ovs:brand/nescafe\".",
          "$ref": "#/$defs/nodeId"
        },
        "type": {
          "description": "Which kind of node this is: \"brand\", \"company\", \"tag\" or \"errand\".",
          "type": "string",
          "minLength": 1
        },
        "label": {
          "description": "The name shown to readers, such as \"Ben & Jerry's\".",
          "type": "string",
          "minLength": 1
        },
        "aliases": {
          "description": "Other spellings or names for this node. Ask search matches them.",
          "type": "array",
          "items": {
            "type": "string"
          }
        },
        "items": {
          "description": "How many entries in the commons carry this brand or tag.",
          "type": "integer",
          "minimum": 0
        },
        "categories": {
          "description": "The ids of the categories this node appears in, such as \"coffee\". For a company, the categories its listed brands appear in; for an errand, the categories its steps use.",
          "type": "array",
          "items": {
            "type": "string",
            "pattern": "^[a-z0-9]+(?:-[a-z0-9]+)*$"
          }
        },
        "ownedBy": {
          "description": "Brands only: the id of the company node that owns this brand, from the ownership map in app/edges.json. Null when no owner is recorded.",
          "type": [
            "string",
            "null"
          ]
        },
        "top": {
          "description": "Brands only: up to three of this brand's highest-scoring entries.",
          "type": "array",
          "items": {
            "$ref": "#/$defs/topPick"
          }
        },
        "reads": {
          "description": "One or two plain sentences shown on the node's page, saying what it is. For a company, the build writes how many brands the ownership map links to it.",
          "type": "string"
        },
        "brands": {
          "description": "Companies only: the ids of brand nodes this company owns that appear in the commons.",
          "type": "array",
          "items": {
            "$ref": "#/$defs/nodeId"
          }
        },
        "brandNames": {
          "description": "Companies only: the names of every brand the ownership map links to this company, whether or not the brand appears in the commons.",
          "type": "array",
          "items": {
            "type": "string"
          }
        },
        "ownershipSources": {
          "description": "Companies only: one record per ownership link, with the source that backs it.",
          "type": "array",
          "items": {
            "$ref": "#/$defs/ownershipSource"
          }
        },
        "kind": {
          "description": "Tags only: \"certification\" (a third party checks the claim), \"property\" (a feature of the product) or \"topic\".",
          "type": "string"
        },
        "receipt": {
          "description": "Tags only: a link to the page that backs the tag, such as the certifier's site. Null when there is none. Certification tags must have one.",
          "type": [
            "string",
            "null"
          ]
        },
        "output": {
          "description": "Errands only: what running the errand produces. The build always writes \"list\".",
          "type": "string"
        },
        "steps": {
          "description": "Errands only: the steps in order. Each names a category id, a label, whether to pick \"one\" or \"several\", and a short note.",
          "type": "array",
          "items": {
            "type": "object"
          }
        }
      }
    },
    "topPick": {
      "type": "object",
      "additionalProperties": true,
      "required": [
        "cat",
        "code",
        "name"
      ],
      "properties": {
        "cat": {
          "description": "The id of the category the entry is in.",
          "type": "string",
          "pattern": "^[a-z0-9]+(?:-[a-z0-9]+)*$"
        },
        "code": {
          "description": "The entry's code within that category, usually its barcode.",
          "type": "string",
          "minLength": 1
        },
        "name": {
          "description": "The entry's name.",
          "type": "string",
          "minLength": 1
        },
        "score": {
          "description": "The entry's score from 0 to 100, using that category's default weights.",
          "type": "number",
          "minimum": 0,
          "maximum": 100
        }
      }
    },
    "ownershipSource": {
      "type": "object",
      "additionalProperties": true,
      "required": [
        "from",
        "brandName",
        "source",
        "asof"
      ],
      "properties": {
        "from": {
          "description": "The id of the brand as written in the ownership map, app/edges.json.",
          "$ref": "#/$defs/nodeId"
        },
        "brand": {
          "description": "The id of the matching brand node in brands.json, or null when that brand has no node there.",
          "type": [
            "string",
            "null"
          ]
        },
        "brandName": {
          "description": "The brand's name as shown to readers.",
          "type": "string",
          "minLength": 1
        },
        "source": {
          "description": "A link to the source that records this ownership.",
          "type": "string",
          "minLength": 1
        },
        "asof": {
          "description": "The date the ownership map gives for this link, usually as YYYY-MM-DD.",
          "type": "string",
          "minLength": 1
        }
      }
    }
  }
}
