{
  "format": "ovs-node-index",
  "type": "company",
  "version": "0.1",
  "built": "2026-07-15",
  "source": "app/edges.json",
  "nodes": [
    {
      "id": "ovs:company/alphabet",
      "type": "company",
      "label": "Alphabet / Google",
      "aliases": [
        "alphabet",
        "Google"
      ],
      "reads": "Our ownership map links Alphabet / Google to 14 brands. 1 appears in the current comparisons.",
      "brands": [
        "ovs:brand/google"
      ],
      "brandNames": [
        "Android",
        "Calico",
        "Chrome",
        "Deepmind",
        "Fitbit",
        "Gemini",
        "Google",
        "Google Cloud",
        "Kaggle",
        "Nest",
        "Verily",
        "Waymo",
        "Waze",
        "Youtube"
      ],
      "ownershipSources": [
        {
          "from": "ovs:brand/android",
          "brand": null,
          "brandName": "Android",
          "source": "https://abc.xyz/",
          "asof": "2026-07-07"
        },
        {
          "from": "ovs:brand/calico",
          "brand": null,
          "brandName": "Calico",
          "source": "https://abc.xyz/",
          "asof": "2026-07-07"
        },
        {
          "from": "ovs:brand/chrome",
          "brand": null,
          "brandName": "Chrome",
          "source": "https://abc.xyz/",
          "asof": "2026-07-07"
        },
        {
          "from": "ovs:brand/deepmind",
          "brand": null,
          "brandName": "Deepmind",
          "source": "https://abc.xyz/",
          "asof": "2026-07-07"
        },
        {
          "from": "ovs:brand/fitbit",
          "brand": null,
          "brandName": "Fitbit",
          "source": "https://abc.xyz/",
          "asof": "2026-07-07"
        },
        {
          "from": "ovs:brand/gemini",
          "brand": null,
          "brandName": "Gemini",
          "source": "https://abc.xyz/",
          "asof": "2026-07-07"
        },
        {
          "from": "ovs:brand/google",
          "brand": "ovs:brand/google",
          "brandName": "Google",
          "source": "https://abc.xyz/",
          "asof": "2026-07-07"
        },
        {
          "from": "ovs:brand/google-cloud",
          "brand": null,
          "brandName": "Google Cloud",
          "source": "https://abc.xyz/",
          "asof": "2026-07-07"
        },
        {
          "from": "ovs:brand/kaggle",
          "brand": null,
          "brandName": "Kaggle",
          "source": "https://abc.xyz/",
          "asof": "2026-07-07"
        },
        {
          "from": "ovs:brand/nest",
          "brand": null,
          "brandName": "Nest",
          "source": "https://abc.xyz/",
          "asof": "2026-07-07"
        },
        {
          "from": "ovs:brand/verily",
          "brand": null,
          "brandName": "Verily",
          "source": "https://abc.xyz/",
          "asof": "2026-07-07"
        },
        {
          "from": "ovs:brand/waymo",
          "brand": null,
          "brandName": "Waymo",
          "source": "https://abc.xyz/",
          "asof": "2026-07-07"
        },
        {
          "from": "ovs:brand/waze",
          "brand": null,
          "brandName": "Waze",
          "source": "https://abc.xyz/",
          "asof": "2026-07-07"
        },
        {
          "from": "ovs:brand/youtube",
          "brand": null,
          "brandName": "Youtube",
          "source": "https://abc.xyz/",
          "asof": "2026-07-07"
        }
      ],
      "categories": [
        "digital-services",
        "email",
        "learning-resources",
        "password-managers",
        "search"
      ],
      "line": "avoid:alphabet",
      "source": "https://abc.xyz/",
      "asof": "2026-07-07"
    },
    {
      "id": "ovs:company/amazon",
      "type": "company",
      "label": "Amazon",
      "aliases": [],
      "reads": "Our ownership map links Amazon to 18 brands. 2 appear in the current comparisons.",
      "brands": [
        "ovs:brand/amazon",
        "ovs:brand/amazon-basics"
      ],
      "brandNames": [
        "Alexa",
        "Amazon",
        "Amazon Basics",
        "Amazon Music",
        "Amazon Pharmacy",
        "Audible",
        "Aws",
        "Eero",
        "Imdb",
        "Kindle",
        "Metro Goldwyn Mayer",
        "Presto",
        "Prime Video",
        "Ring",
        "Twitch",
        "Whole Foods Market",
        "Wondery",
        "Zappos"
      ],
      "ownershipSources": [
        {
          "from": "ovs:brand/alexa",
          "brand": null,
          "brandName": "Alexa",
          "source": "https://s2.q4cdn.com/299287126/files/doc_financials/2025/ar/Amazon-2024-Annual-Report.pdf",
          "asof": "2025"
        },
        {
          "from": "ovs:brand/amazon",
          "brand": "ovs:brand/amazon",
          "brandName": "Amazon",
          "source": "https://s2.q4cdn.com/299287126/files/doc_financials/2025/ar/Amazon-2024-Annual-Report.pdf",
          "asof": "2025"
        },
        {
          "from": "ovs:brand/amazon-basics",
          "brand": "ovs:brand/amazon-basics",
          "brandName": "Amazon Basics",
          "source": "https://s2.q4cdn.com/299287126/files/doc_financials/2025/ar/Amazon-2024-Annual-Report.pdf",
          "asof": "2025"
        },
        {
          "from": "ovs:brand/amazon-music",
          "brand": null,
          "brandName": "Amazon Music",
          "source": "https://s2.q4cdn.com/299287126/files/doc_financials/2025/ar/Amazon-2024-Annual-Report.pdf",
          "asof": "2025"
        },
        {
          "from": "ovs:brand/amazon-pharmacy",
          "brand": null,
          "brandName": "Amazon Pharmacy",
          "source": "https://s2.q4cdn.com/299287126/files/doc_financials/2025/ar/Amazon-2024-Annual-Report.pdf",
          "asof": "2025"
        },
        {
          "from": "ovs:brand/audible",
          "brand": null,
          "brandName": "Audible",
          "source": "https://s2.q4cdn.com/299287126/files/doc_financials/2025/ar/Amazon-2024-Annual-Report.pdf",
          "asof": "2025"
        },
        {
          "from": "ovs:brand/aws",
          "brand": null,
          "brandName": "Aws",
          "source": "https://s2.q4cdn.com/299287126/files/doc_financials/2025/ar/Amazon-2024-Annual-Report.pdf",
          "asof": "2025"
        },
        {
          "from": "ovs:brand/eero",
          "brand": null,
          "brandName": "Eero",
          "source": "https://s2.q4cdn.com/299287126/files/doc_financials/2025/ar/Amazon-2024-Annual-Report.pdf",
          "asof": "2025"
        },
        {
          "from": "ovs:brand/imdb",
          "brand": null,
          "brandName": "Imdb",
          "source": "https://s2.q4cdn.com/299287126/files/doc_financials/2025/ar/Amazon-2024-Annual-Report.pdf",
          "asof": "2025"
        },
        {
          "from": "ovs:brand/kindle",
          "brand": null,
          "brandName": "Kindle",
          "source": "https://s2.q4cdn.com/299287126/files/doc_financials/2025/ar/Amazon-2024-Annual-Report.pdf",
          "asof": "2025"
        },
        {
          "from": "ovs:brand/metro-goldwyn-mayer",
          "brand": null,
          "brandName": "Metro Goldwyn Mayer",
          "source": "https://s2.q4cdn.com/299287126/files/doc_financials/2025/ar/Amazon-2024-Annual-Report.pdf",
          "asof": "2025"
        },
        {
          "from": "ovs:brand/presto",
          "brand": null,
          "brandName": "Presto",
          "source": "https://s2.q4cdn.com/299287126/files/doc_financials/2025/ar/Amazon-2024-Annual-Report.pdf",
          "asof": "2025"
        },
        {
          "from": "ovs:brand/prime-video",
          "brand": null,
          "brandName": "Prime Video",
          "source": "https://s2.q4cdn.com/299287126/files/doc_financials/2025/ar/Amazon-2024-Annual-Report.pdf",
          "asof": "2025"
        },
        {
          "from": "ovs:brand/ring",
          "brand": null,
          "brandName": "Ring",
          "source": "https://s2.q4cdn.com/299287126/files/doc_financials/2025/ar/Amazon-2024-Annual-Report.pdf",
          "asof": "2025"
        },
        {
          "from": "ovs:brand/twitch",
          "brand": null,
          "brandName": "Twitch",
          "source": "https://s2.q4cdn.com/299287126/files/doc_financials/2025/ar/Amazon-2024-Annual-Report.pdf",
          "asof": "2025"
        },
        {
          "from": "ovs:brand/whole-foods-market",
          "brand": null,
          "brandName": "Whole Foods Market",
          "source": "https://s2.q4cdn.com/299287126/files/doc_financials/2025/ar/Amazon-2024-Annual-Report.pdf",
          "asof": "2025"
        },
        {
          "from": "ovs:brand/wondery",
          "brand": null,
          "brandName": "Wondery",
          "source": "https://s2.q4cdn.com/299287126/files/doc_financials/2025/ar/Amazon-2024-Annual-Report.pdf",
          "asof": "2025"
        },
        {
          "from": "ovs:brand/zappos",
          "brand": null,
          "brandName": "Zappos",
          "source": "https://s2.q4cdn.com/299287126/files/doc_financials/2025/ar/Amazon-2024-Annual-Report.pdf",
          "asof": "2025"
        }
      ],
      "categories": [
        "books",
        "digital-services",
        "laundry",
        "paper-goods",
        "period-products"
      ],
      "line": "avoid:amazon",
      "source": "https://s2.q4cdn.com/299287126/files/doc_financials/2025/ar/Amazon-2024-Annual-Report.pdf",
      "asof": "2025"
    },
    {
      "id": "ovs:company/apple",
      "type": "company",
      "label": "Apple",
      "aliases": [],
      "reads": "Our ownership map links Apple to 11 brands. None is in the current comparisons yet.",
      "brands": [],
      "brandNames": [
        "Airpods",
        "App Store",
        "Apple Music",
        "Apple Tv Plus",
        "Apple Watch",
        "Beats",
        "Icloud",
        "Ipad",
        "Iphone",
        "Mac",
        "Shazam"
      ],
      "ownershipSources": [
        {